swift_code,id,bank,city,branch
CRGGNZ21,1,ABN AMRO CRAIGS LTD,AUCKLAND,None
ABNANZA1,2,ABN AMRO SECURITIES NZ LIMITED.,AUCKLAND,None
ACCRNZ21,3,ACCESS BROKERAGE LTD,WELLINGTON,None
ACCNNZ21,4,ACCIDENT COMPENSATION CORPORATION,WELLINGTON,None
ACCNNZ2B,5,ACCIDENT COMPENSATION CORPORATION,WELLINGTON,None
CEIINZ21,6,AI CREDIT FINANCE LIMITED,AUCKLAND,None
SSBTNZ2A,7,ALLIANT PERPETUAL,HAMILTON,None
ALNUNZ21,8,ALLOZY FINANCIAL GROUP LIMITED,AUCKLAND,None
ALIUNZ21,9,ALLOZY FINANCIAL TRUST,CHRISTCHURCH,None
ANINNZ21,10,ANTS INTERNATIONAL L.P.,AUCKLAND,None
ANZBNZ22102,11,ANZ BANK NEW ZEALAND LIMITED,AUCKLAND,(AUCKLAND CENTRAL)
ANZBNZ22797,12,ANZ BANK NEW ZEALAND LIMITED,CHRISTCHURCH,None
ANZBNZ22,13,ANZ BANK NEW ZEALAND LIMITED,WELLINGTON,None
ANZBNZ22058,14,ANZ BANK NEW ZEALAND LIMITED,WELLINGTON,None
AMCLNZ21,15,ANZ MCCAUGHAN SECURITIES (NZ) LTD,AUCKLAND,None
ANZINZ21,16,ANZ NEW ZEALAND INVESTMENTS LIMITED,AUCKLAND,None
ASBBNZ2AGRI,17,ASB BANK LIMITED,AUCKLAND,(ASB GROUP INVESTMENTS)
ASBBNZ2ACLS,18,ASB BANK LIMITED,AUCKLAND,(CLS PAYMENTS ONLY)
ASBBNZ2AFXD,19,ASB BANK LIMITED,AUCKLAND,(FOREIGN EXCHANGE)
ASBBNZ2AITS,20,ASB BANK LIMITED,AUCKLAND,(INTERNATIONAL TRADE SERVICES)
ASBBNZ2AMMD,21,ASB BANK LIMITED,AUCKLAND,(MONEY MARKET)
ASBBNZ2ASEC,22,ASB BANK LIMITED,AUCKLAND,(SECURITIES)
ASBBNZ2A,23,ASB BANK LIMITED,AUCKLAND,None
APGTNZ21,24,ASIA PACIFIC BANKING GROUP AUSTRALIA AND NEW ZEALAND,AUCKLAND,None
APFENZ21,25,ASIA PACIFIC FINANCIAL SERVICES LIMITED,WELLINGTON,None
AUSLNZ21,26,AUCKLAND SAVINGS AND LOAN LIMITED,TAURANGA,None
BALMNZ21,27,BALDWIN SMITH AND CO,BLENHEIM,None
BARBNZ2A,28,BANK OF BARODA (NEW ZELAND) LTD,AUCKLAND,None
BKCHNZ22,29,BANK OF CHINA (NEW ZEALAND) LIMITED,AUCKLAND,None
BKIDNZ2A,30,BANK OF INDIA (NEW ZEALAND) LIMITED,AUCKLAND,None
BKNZNZ22100,31,BANK OF NEW ZEALAND,AUCKLAND,(AUCKLAND)
BKNZNZ22800,32,BANK OF NEW ZEALAND,CHRISTCHURCH,(CHRISTCHURCH)
BKNZNZ22900,33,BANK OF NEW ZEALAND,DUNEDIN,(DUNEDIN)
BKNZNZ22985,34,BANK OF NEW ZEALAND,WELLINGTON,(HEAD OFFICE)
BKNZNZ22500,35,BANK OF NEW ZEALAND,WELLINGTON,(WELLINGTON)
BKNZNZ22,36,BANK OF NEW ZEALAND,WELLINGTON,None
BCWCNZ21,37,BCB WORLD CLEAR LIMITED,AUCKLAND,None
BIRRNZ21,38,BINARY CREDIT LTD,AUCKLAND,None
BISMNZ21,39,BISHOP CAMPBELL AND CO,TIMARU,None
BATSNZA1,40,BRITISH AMERICAN TOBACCO (NEW ZEALAND) LIMITED,AUCKLAND,None
BRENNZ21,41,BROOK ASSET MANAGEMENT,AUCKLAND,None
HOGMNZ21,42,CC HOLDINGS FINANCIAL SERVICES LTD,AUCKLAND,None
CETPNZ21,43,CENTIX CAPITAL LIMITED,AUCKLAND,None
CENFNZ21,44,CENTURION FINANCE LIMITED,AUCKLAND,None
CEBNNZ21,45,CENTURY BANCORP,AUCKLAND,None
CSLTNZ21,46,CHARTERED SAVINGS AND LOAN LIMITED,AUCKLAND,None
PCBCNZ22,47,CHINA CONSTRUCTION BANK LTD,AUCKLAND,None
CITINZ2XCOP,48,CITIBANK NA NEW ZEALAND BRANCH,AUCKLAND,(CO-OP)
CITINZ2X,49,CITIBANK NA NEW ZEALAND BRANCH,AUCKLAND,None
CITINZ2102W,50,CITIBANK NA NEW ZEALAND BRANCH,WELLINGTON,None
SSSANZ21,51,CITIGROUP GLOBAL MARKETS NEW ZEALAND LTD.,WELLINGTON,None
CLAENZ21,52,CLAVELL EQUITIES,AUCKLAND,None
CMCKNZ2A,53,CMC MARKETS NZ LIMITED,AUCKLAND,None
COVONZ21,54,COGENT INVESTMENT OPERATIONS,WELLINGTON,None
CNCTNZ21,55,CONTINENTAL CAPITAL LTD,TAURANGA,None
CNFGNZ21,56,CONTINENTAL FINANCE GROUP LTD,MOUNT MAUNGANUI,None
CPNZNZA1,57,CO-OP MONEY NZ,AUCKLAND,None
CNSNNZ21,58,COUNTY NATWEST SECURITIES (NEW ZEALAND),WELLINGTON,None
CRAINZ21,59,CRAIG AND CO LTD,TAURANGA,None
CURRNZ21,60,CURRENCY ONLINE LIMITED,CHRISTCHURCH,None
DMGANZ21,61,DEUTSCHE MORGAN GRENFELL AUCKLAND NEW ZEALAND,AUCKLAND,None
DMGLNZ21,62,DEUTSCHE MORGAN GRENFELL WELLINGTON,WELLINGTON,None
DEUSNZ21,63,DEUTSCHE SECURITIES NEW ZEALAND LIMITED,AUCKLAND,None
DEFMNZ21,64,DEVON FUNDS MANAGEMENT,AUCKLAND,None
DIRBNZ21,65,DIRECT BROKING LTD,WELLINGTON,None
DIXINZ21,66,DIXIPAY LIMITED,AUCKLAND,None
EGDWNZ21,67,EGDEN WIGNALL AND CO,CHRISTCHURCH,None
ESAUNZ21,68,ESAM CUSHING AND CO,HASTINGS,None
EXNENZ22,69,EXNESS LIMITED,AUCKLAND,None
FAYRNZ2102A,70,FAY, RICHWHITE AND COMPANY LIMITED,AUCKLAND,None
FAYRNZ21,71,FAY, RICHWHITE AND COMPANY LIMITED,WELLINGTON,None
FEXONZ21,72,FEXCO (NZ) LIMITED,AUCKLAND,None
FGCCNZ21,73,FGBC LIMITED,TAKAPUNA,None
FIXCNZ21,74,FIRST EXCELSIOR LTD,AUCKLAND,None
FICQNZ21,75,FIRST NZ CAPITAL EQUITIES LIMITED,WELLINGTON,None
FPTUNZ21,76,FIRST PACIFIC TRUST LTD,AUCKLAND,None
FPNZNZ2A,77,FISHER AND PAYKEL APPLIANCES LIMITED,AUCKLAND,None
FONTNZ2A,78,FONTERRA CO-OPERATIVE GROUP LIMITED,AUCKLAND,None
FORBNZ21,79,FORSYTH BARR LTD,DUNEDIN,None
GABSNZ21,80,GABITES SINCLAIR AND PARTNERS,ASHBURTON,None
GMIPNZ21,81,GARETH MORGAN INVESTMENTS LIMITED PARTNERSHIP,WELLINGTON,None
GARLNZ21,82,GARLICK AND CO LTD,WELLINGTON,None
GEIANZ21,83,GENCO FINANCE LP,AUCKLAND,None
GLEGNZ21,84,GLENDINNING AND GLENDINNING,PALMERSTON NORTH,None
HECRNZ21,85,GLOBAL FINANCIAL TRUST,LAMBTON,None
GLIUNZ21,86,GLOBALRE INSURANCE LIMITED,AUCKLAND,None
JBWANZ21,87,GOLDMAN SACHS NEW ZEALAND LIMITED,AUCKLAND,None
GOUSNZ21,88,GOULD STEELE AND CO,WELLINGTON,None
WIEGNZ21,89,GREENSLADES LTD,DUNEDIN,None
GMITNZ21,90,GREG MITCHELL,CHRISTCHURCH,None
GNZSNZ2A,91,GUARDIANS OF NEW ZEALAND SUPERANNUATION,AUCKLAND,None
HAHGNZ21,92,HAMILTON HINDIN GREENE,CHRISTCHURCH,None
HASONZ21,93,HAMPSHIRE SAVINGS AND LOAN LIMITED,MANLY,None
HAAMNZ21,94,HARBOUR ASSET MANAGEMENT LIMITED,WELLINGTON,None
HAAMNZ2B,95,HARBOUR ASSET MANAGEMENT LIMITED,WELLINGTON,None
HIFXNZ2A,96,HIFX LTD,AUCKLAND,None
HSBCNZ2ACLS,97,HONGKONG AND SHANGHAI BANKING CORPORATION LIMITED, THE,AUCKLAND,(CONTINUOUS LINK SETTELMENT DEPARTMENT)
HSBCNZ2A,98,HONGKONG AND SHANGHAI BANKING CORPORATION LIMITED, THE,AUCKLAND,None
HSBCNZ2ACHC,99,HONGKONG AND SHANGHAI BANKING CORPORATION LIMITED, THE,CHRISTCHURCH,(CHRISTCHURCH BRANCH)
HSBCNZ2AWLT,100,HONGKONG AND SHANGHAI BANKING CORPORATION LIMITED, THE,WELLINGTON,(WELLINGTON BRANCH)
IDHTNZ21,101,IDLYC HOLDINGS TRUST,HAMILTON,None
ICBKNZ2A,102,INDUSTRIAL AND COMMERCIAL BANK OF CHINA (NEW ZEALAND) LIMITED,AUCKLAND,None
IVSCNZ21,103,INVESTA SECURITIES LTD.,AUCKLAND,None
ISFGNZ21,104,ISC FINANCIAL GROUP LTD,AUCKLAND,None
RPSLNZ21,105,J. ROTHSCHILD PPG SECURITIES LIMITE,AUCKLAND,None
JFLENZ21,106,JARDINE FLEMING NEW ZEALAND LIMITED,WELLINGTON,None
JBNMNZ21,107,JBWERE (NZ) NOMINEES LIMITED,AUCKLAND,None
CHAANZ21,108,JOHN CHAPMAN,TAUPO,None
CHASNZ2ACCS,109,JPMORGAN CHASE BANK, N.A., NEW ZEALAND BRANCH,AUCKLAND,(WSS LOCAL CUSTODIAN SERVICES)
CHASNZ2A,110,JPMORGAN CHASE BANK, N.A., NEW ZEALAND BRANCH,WELLINGTON,None
KIPENZ21,111,KIPIE LIMITED,AUCKLAND,None
KIWINZ22,112,KIWIBANK LIMITED,WELLINGTON,None
NZRCNZ2W,113,KIWIRAIL HOLDINGS LIMITED,WELLINGTON,None
CZNBNZ2A,114,KOOKMIN BANK, AUCKLAND BRANCH,AUCKLAND,None
KTECNZ21,115,KTEC NZ LIMITED,HAMILTON,None
KTECNZ21NRG,116,KTEC NZ LIMITED,HAMILTON,None
LAMHNZ21,117,LAWRENCE MILLTON AND HOWARTH,CHRISTCHURCH,None
LECTNZ21,118,LEGACY CAPITAL TRUST,AUCKLAND,None
LEEFNZ21,119,LEVERAGED EQUITIES FINANCE LTD,WELLINGTON,None
LOAINZ21,120,LONDON CAPITAL NZ LTD,AUCKLAND,None
SINENZ21,121,LR SINGLETON AND CO,HASTINGS,None
MACQNZ21,122,MACQUARIE EQUITIES NEW ZEALAND LTD,WELLINGTON,None
MSNZNZ21,123,MACQUARIE SECURITIES NEW ZEALAND LIMITED,AUCKLAND,None
MGPINZ21,124,MAGNATE PREMIER LIMITED,AUCKLAND,None
MAVTNZ21,125,MAMA SAVINGS TRUST LTD,PAPAKURA,None
DCFSNZ2A,126,MERCEDES-BENZ FINANCIAL SERVICES NEW ZEALAND LTD.,AUCKLAND,None
DABENZ2A,127,MERCEDES-BENZ NEW ZEALAND LTD.,AUCKLAND,None
MCGONZ21,128,MERCHANT CREDIT AND GUARANTEE CORPORATION LIMITED,AUCKLAND,None
MEONNZ21,129,MERCXYZ ONE LIMITED,AUCKLAND,None
MIANNZ21,130,MILFORD ASSET MANAGEMENT,AUCKLAND,None
MFIWNZ21,131,MILLENNIUM FIXED INCOME (NEW ZEALAND),AUCKLAND,None
MMCCNZ21BTW,132,MMC LIMITED,AUCKLAND,(BT/WESTPAC FUNDS MANAGEMENT)
MMCCNZ21MIL,133,MMC LIMITED,AUCKLAND,(MILFORD ASSET MANAGEMENT)
MMCCNZ21MIN,134,MMC LIMITED,AUCKLAND,(MINT ASSET MANAGEMENT)
MMCCNZ21PGT,135,MMC LIMITED,AUCKLAND,(PERPETUAL GUARDIAN TRUST)
MMCCNZ21SLT,136,MMC LIMITED,AUCKLAND,(SALT FUNDS MANAGEMENT)
MMCCNZ21SUN,137,MMC LIMITED,AUCKLAND,(SUNCORP GROUP NZ LTD)
MMCCNZ21,138,MMC LIMITED,AUCKLAND,None
MMCCNZ21TYN,139,MMC LIMITED,AUCKLAND,None
MMCCNZ23,140,MMC LIMITED,AUCKLAND,None
MDCFNZ21001,141,MORGAN DEVERE CORPORATE FINANCE LIMITED,WELLINGTON,(ADMINISTRATION)
MDCFNZ21,142,MORGAN DEVERE CORPORATE FINANCE LIMITED,WELLINGTON,None
MUNHNZ21,143,MUNRO, ALAN RODERICK AND WALDEN, DALE CHARLES,TIMARU,None
NAAPNZ21,144,NAPIER CAPITAL LIMITED,NAPIER,None
NAFGNZ21,145,NATIONAL FINANCE GROUP LTD,MOUNT MAUNGANUI,None
NATANZ22,146,NATIONAL NOMINEES LIMITED,WELLINGTON,None
NZEUNZ21,147,NEW ZEALAND EMISSION UNIT REGISTER,WELLINGTON,None
NZXCNZ2W,148,NEW ZEALAND EXCHANGE LIMITED,WELLINGTON,None
XNEENZ21,149,NEW ZEALAND FUTURES AND OPTIONS EXCHANGE,AUCKLAND,None
NZIFNZ21,150,NEW ZEALAND INTERNATIONAL FINANCE LIMITED,WELLINGTON,None
NZISNZ21,151,NEW ZEALAND INTERNATIONAL SAVINGS AND LOAN LTD,AUCKLAND,None
XAUKNZ21,152,NEW ZEALAND STOCK EXCHANGE - AUCKLAND,AUCKLAND,None
NZSFNZ21,153,NEW ZEALAND SUPERANNUATION FUND,AUCKLAND,None
NZTRNZ2W,154,NEW ZEALAND TREASURY,WELLINGTON,None
NIKENZ21,155,NIKE NEW ZEALAND LIMITED,AUCKLAND,None
NOBLNZ21,156,NOBLE AND LEE LTD.,MATAMATA,None
NMFSNZ21,157,NRG MONEY FINANCIAL SERVICES LIMITE,WHANGAREI,None
NZCANZ21,158,NZI CAPITAL SAVINGS LIMITED,AUCKLAND,None
MACENZ21,159,NZIJ STOCKBROKERS LTD,WELLINGTON,None
OPMONZ21,160,OPT MOBILE LIMITED,AUCKLAND,None
OMGLNZ2102A,161,ORD MINNETT GROUP LTD. WELLINGTON,AUCKLAND,None
OMGLNZ21,162,ORD MINNETT GROUP LTD. WELLINGTON,WELLINGTON,None
OVTFNZ21,163,OVERSEAS TRADE FINANCE,AUCKLAND,None
GEBSNZ2A,164,PACIFIC EAGLE CAPITAL,AUCKLAND,None
PVCTNZ21,165,PACIFIC VENTURE CAPITAL TRUST,AUCKLAND,None
PAIRNZ21,166,PANTERRA FINANCIAL SERVICES, LTD.,AUCKLAND,None
STTPNZ21,167,PB STANDARD CAPITAL LIMITED,AUCKLAND,None
PSCLNZ21,168,PHOENIX SOFTWARE CORPORATION LTD,JOHNSONVILLE,None
PMBINZ21,169,PMB INVESTMENTS LIMITED,AUCKLAND,None
STOYNZ21,170,R M STORY AND CO,WANGANUI,None
RABONZ2W,171,RABOBANK NEW ZEALAND BRANCH,WELLINGTON,None
RABONZ22,172,RABOBANK NEW ZEALAND LIMITED,WELLINGTON,None
REGANZ21,173,REGAN AND CO,NEW PLYMOUTH,None
RBNZNZ22,174,RESERVE BANK OF NEW ZEALAND,WELLINGTON,None
RBNZNZ2S,175,RESERVE BANK OF NEW ZEALAND,WELLINGTON,None
RBNZNZ2SASA,176,RESERVE BANK OF NEW ZEALAND,WELLINGTON,None
RBNZNZ2STIA,177,RESERVE BANK OF NEW ZEALAND,WELLINGTON,None
RBNZNZ2W,178,RESERVE BANK OF NEW ZEALAND,WELLINGTON,None
RBNZNZ2WACC,179,RESERVE BANK OF NEW ZEALAND,WELLINGTON,None
RBNZNZ2WCCY,180,RESERVE BANK OF NEW ZEALAND,WELLINGTON,None
RIFLNZ21,181,RIEH FINANCIAL LIMITED,PAPAKURA,None
RSSSNZ21,182,ROSS, SINCLAIR AND CO.,ASHBURTON,None
SAUMNZ21,183,SALT FUNDS MANAGEMENT LIMITED,AUCKLAND,None
SECTNZ21,184,SAMSUNG ELECTRONICS NEW ZEALAND LTD,AUCKLAND,None
SENCNZ21,185,SEAMED FINANCE LTD,AUCKLAND,None
SMASNZ21,186,SMARTSHARES LIMITED,WELLINGTON,None
SOSRNZ21,187,SOMERSET SMITH PARTNERS,NAPIER,None
SAORNZ21,188,SOVEREIGN AMERICAN CROWN TRUST,AUCKLAND,None
TECDNZ21,189,TEA CUSTODIANS LIMITED,WELLINGTON,None
CEGPNZ21,190,THE CELESTINE GROUP LIMITED,AUCKLAND,None
TMTCNZ2A,191,TRADE AND MERCHANT TRUST COMPANY LIMITED,AUCKLAND,None
TRPWNZ21,192,TRILLION PRIVATE WEALTH LTD,AUCKLAND,None
TREXNZ22,193,TRUSTEES EXECUTORS LIMITED,WELLINGTON,None
TSBANZ22,194,TSB BANK LIMITED,NEW PLYMOUTH,None
BUTWNZ21,195,UBS NEW ZEALAND LTD,AUCKLAND,None
ULFSNZ21,196,ULTIMATE FINANCIAL SERVICES LP,AUCKLAND,None
UNGFNZ21,197,UNIVERSAL GOLD FINANCE LIMITED,AUCKLAND,None
VUFSNZ21,198,VUM FINANCIAL SERVICES LIMITED,NAPIER,None
CHFXNZ21,199,WESTERN UNION BUSINESS SOLUTIONS (NEW ZEALAND),WELLINGTON,None
WPACNZ2W,200,WESTPAC NEW ZEALAND LIMITED, A WHOLLY OWNED SUBSIDIARY OF WESTPAC BANKING CORPORATION,AUCKLAND,(FOR ALL NEW ZEALAND BRANCHES)
WTSLNZ21,201,WESTPACTRUST SECURITIES NZ LTD,WELLINGTON,None
WINKNZ21,202,WINSTANLEY AND DICKSON,BLENHEIM,None
WMGYNZ21,203,WMG YOVICH AND CO,WHANGAREI,None
WOALNZ21,204,WOLF ALLIANCE LTD,AUCKLAND,None
WOLSNZ21,205,WOLF SPARKASSE,AUCKLAND,None
WOPSNZ21,206,WOODWARD PARTNERS SECURITIES LIMITED,WELLINGTON,None
WORCNZ22,207,WORLDCLEAR LTD,HAMILTON,None
WOFENZ21,208,WORLDNET FINANCIAL SERVICES LIMITED,HAMILTON,None
YOUGNZ21,209,YOUNG AND CO,PALMERSTON NORTH,None
